{
	"baseitem": [
		{
			"name": "Antimatter Rifle",
			"source": "DMG",
			"page": 268,
			"type": "R",
			"rarity": "none",
			"weight": 10,
			"weaponCategory": "martial",
			"age": "futuristic",
			"property": [
				"AF",
				"RLD",
				"2H"
			],
			"range": "120/360",
			"reload": 2,
			"dmg1": "6d8",
			"dmgType": "N",
			"firearm": true,
			"weapon": true,
			"ammoType": "energy cell"
		},
		{
			"name": "Arrow",
			"source": "PHB",
			"page": 150,
			"srd": true,
			"basicRules": true,
			"type": "A",
			"rarity": "none",
			"weight": 0.05,
			"value": 5
		},
		{
			"name": "Arrows (20)",
			"source": "PHB",
			"page": 150,
			"srd": true,
			"basicRules": true,
			"type": "A",
			"rarity": "none",
			"weight": 1,
			"value": 100,
			"packContents": [
				{
					"item": "arrow|phb",
					"quantity": 20
				}
			]
		},
		{
			"name": "Automatic Pistol",
			"source": "DMG",
			"page": 268,
			"type": "R",
			"rarity": "none",
			"weight": 3,
			"weaponCategory": "martial",
			"age": "modern",
			"property": [
				"AF",
				"RLD"
			],
			"range": "50/150",
			"reload": 15,
			"dmg1": "2d6",
			"dmgType": "P",
			"firearm": true,
			"weapon": true,
			"ammoType": "modern bullet"
		},
		{
			"name": "Automatic Rifle",
			"source": "DMG",
			"page": 268,
			"type": "R",
			"rarity": "none",
			"weight": 8,
			"weaponCategory": "martial",
			"age": "modern",
			"property": [
				"AF",
				"BF",
				"RLD",
				"2H"
			],
			"range": "80/240",
			"reload": 30,
			"dmg1": "2d8",
			"dmgType": "P",
			"firearm": true,
			"weapon": true,
			"ammoType": "modern bullet"
		},
		{
			"name": "Battleaxe",
			"source": "PHB",
			"page": 149,
			"srd": true,
			"basicRules": true,
			"type": "M",
			"rarity": "none",
			"weight": 4,
			"value": 1000,
			"weaponCategory": "martial",
			"property": [
				"V"
			],
			"dmg1": "1d8",
			"dmgType": "S",
			"dmg2": "1d10",
			"axe": true,
			"weapon": true
		},
		{
			"name": "Blowgun",
			"source": "PHB",
			"page": 149,
			"srd": true,
			"basicRules": true,
			"type": "R",
			"rarity": "none",
			"weight": 1,
			"value": 1000,
			"weaponCategory": "martial",
			"property": [
				"A",
				"LD"
			],
			"range": "25/100",
			"dmg1": "1",
			"dmgType": "P",
			"weapon": true,
			"ammoType": "blowgun needle|phb"
		},
		{
			"name": "Blowgun Needle",
			"source": "PHB",
			"page": 150,
			"srd": true,
			"basicRules": true,
			"type": "A",
			"rarity": "none",
			"weight": 0.02,
			"value": 2
		},
		{
			"name": "Blowgun Needles (50)",
			"source": "PHB",
			"page": 150,
			"srd": true,
			"basicRules": true,
			"type": "A",
			"rarity": "none",
			"weight": 1,
			"value": 100,
			"packContents": [
				{
					"item": "blowgun needle|phb",
					"quantity": 50
				}
			]
		},
		{
			"name": "Breastplate",
			"source": "PHB",
			"page": 145,
			"srd": true,
			"basicRules": true,
			"type": "MA",
			"rarity": "none",
			"weight": 20,
			"value": 40000,
			"ac": 14,
			"armor": true,
			"entries": [
				"This armor consists of a fitted metal chest piece worn with supple leather. Although it leaves the legs and arms relatively unprotected, this armor provides good protection for the wearer's vital organs while leaving the wearer relatively unencumbered."
			]
		},
		{
			"name": "Chain Mail",
			"source": "PHB",
			"page": 145,
			"srd": true,
			"basicRules": true,
			"type": "HA",
			"rarity": "none",
			"weight": 55,
			"value": 7500,
			"ac": 16,
			"strength": "13",
			"armor": true,
			"stealth": true,
			"entries": [
				"Made of interlocking metal rings, chain mail includes a layer of quilted fabric worn underneath the mail to prevent chafing and to cushion the impact of blows. The suit includes gauntlets."
			]
		},
		{
			"name": "Chain Shirt",
			"source": "PHB",
			"page": 144,
			"srd": true,
			"basicRules": true,
			"type": "MA",
			"rarity": "none",
			"weight": 20,
			"value": 5000,
			"ac": 13,
			"armor": true,
			"entries": [
				"Made of interlocking metal rings, a chain shirt is worn between layers of clothing or leather. This armor offers modest protection to the wearer's upper body and allows the sound of the rings rubbing against one another to be muffled by outer layers."
			]
		},
		{
			"name": "Club",
			"source": "PHB",
			"page": 149,
			"srd": true,
			"basicRules": true,
			"type": "M",
			"rarity": "none",
			"weight": 2,
			"value": 10,
			"weaponCategory": "simple",
			"property": [
				"L"
			],
			"dmg1": "1d4",
			"dmgType": "B",
			"club": true,
			"weapon": true
		},
		{
			"name": "Crossbow Bolt",
			"source": "PHB",
			"page": 150,
			"srd": true,
			"basicRules": true,
			"type": "A",
			"rarity": "none",
			"weight": 0.075,
			"value": 5
		},
		{
			"name": "Crossbow Bolts (20)",
			"source": "PHB",
			"page": 150,
			"srd": true,
			"basicRules": true,
			"type": "A",
			"rarity": "none",
			"weight": 1.5,
			"value": 100,
			"packContents": [
				{
					"item": "crossbow bolt|phb",
					"quantity": 20
				}
			]
		},
		{
			"name": "Crystal",
			"source": "PHB",
			"page": 151,
			"srd": true,
			"basicRules": true,
			"type": "SCF",
			"scfType": "arcane",
			"rarity": "none",
			"weight": 1,
			"value": 1000
		},
		{
			"name": "Dagger",
			"source": "PHB",
			"page": 149,
			"srd": true,
			"basicRules": true,
			"type": "M",
			"rarity": "none",
			"weight": 1,
			"value": 200,
			"weaponCategory": "simple",
			"property": [
				"F",
				"L",
				"T"
			],
			"range": "20/60",
			"dmg1": "1d4",
			"dmgType": "P",
			"dagger": true,
			"weapon": true
		},
		{
			"name": "Dart",
			"source": "PHB",
			"page": 149,
			"srd": true,
			"basicRules": true,
			"type": "R",
			"rarity": "none",
			"weight": 0.25,
			"value": 5,
			"weaponCategory": "simple",
			"property": [
				"F",
				"T"
			],
			"range": "20/60",
			"dmg1": "1d4",
			"dmgType": "P",
			"weapon": true
		},
		{
			"name": "Double-Bladed Scimitar",
			"source": "ERLW",
			"page": 21,
			"otherSources": [
				{
					"source": "UAWGE",
					"page": 74
				}
			],
			"type": "M",
			"rarity": "none",
			"weight": 6,
			"value": 10000,
			"weaponCategory": "martial",
			"property": [
				"S",
				"2H"
			],
			"dmg1": "2d4",
			"dmgType": "S",
			"sword": true,
			"weapon": true,
			"entries": [
				{
					"type": "entries",
					"name": "Special",
					"entries": [
						"If you attack with a double-bladed scimitar as part of the {@action Attack} action on your turn, you can use a bonus action immediately after to make a melee attack with it. This attack deals {@dice 1d4} slashing damage on a hit, instead of {@dice 2d4}."
					]
				}
			],
			"hasFluff": true
		},
		{
			"name": "Energy Cell",
			"source": "DMG",
			"page": 268,
			"type": "AF",
			"rarity": "none",
			"weight": 0.3125,
			"age": "futuristic"
		},
		{
			"name": "Flail",
			"source": "PHB",
			"page": 149,
			"srd": true,
			"basicRules": true,
			"type": "M",
			"rarity": "none",
			"weight": 2,
			"value": 1000,
			"weaponCategory": "martial",
			"dmg1": "1d8",
			"dmgType": "B",
			"weapon": true
		},
		{
			"name": "Glaive",
			"source": "PHB",
			"page": 149,
			"srd": true,
			"basicRules": true,
			"type": "M",
			"rarity": "none",
			"weight": 6,
			"value": 2000,
			"weaponCategory": "martial",
			"property": [
				"H",
				"R",
				"2H"
			],
			"dmg1": "1d10",
			"dmgType": "S",
			"weapon": true
		},
		{
			"name": "Greataxe",
			"source": "PHB",
			"page": 149,
			"srd": true,
			"basicRules": true,
			"type": "M",
			"rarity": "none",
			"weight": 7,
			"value": 3000,
			"weaponCategory": "martial",
			"property": [
				"H",
				"2H"
			],
			"dmg1": "1d12",
			"dmgType": "S",
			"axe": true,
			"weapon": true
		},
		{
			"name": "Greatclub",
			"source": "PHB",
			"page": 149,
			"srd": true,
			"basicRules": true,
			"type": "M",
			"rarity": "none",
			"weight": 10,
			"value": 20,
			"weaponCategory": "simple",
			"property": [
				"2H"
			],
			"dmg1": "1d8",
			"dmgType": "B",
			"club": true,
			"weapon": true
		},
		{
			"name": "Greatsword",
			"source": "PHB",
			"page": 149,
			"srd": true,
			"basicRules": true,
			"type": "M",
			"rarity": "none",
			"weight": 6,
			"value": 5000,
			"weaponCategory": "martial",
			"property": [
				"H",
				"2H"
			],
			"dmg1": "2d6",
			"dmgType": "S",
			"sword": true,
			"weapon": true
		},
		{
			"name": "Halberd",
			"source": "PHB",
			"page": 149,
			"srd": true,
			"basicRules": true,
			"type": "M",
			"rarity": "none",
			"weight": 6,
			"value": 2000,
			"weaponCategory": "martial",
			"property": [
				"H",
				"R",
				"2H"
			],
			"dmg1": "1d10",
			"dmgType": "S",
			"weapon": true
		},
		{
			"name": "Half Plate Armor",
			"source": "PHB",
			"page": 145,
			"srd": true,
			"basicRules": true,
			"type": "MA",
			"rarity": "none",
			"weight": 40,
			"value": 75000,
			"ac": 15,
			"armor": true,
			"stealth": true,
			"entries": [
				"Half plate consists of shaped metal plates that cover most of the wearer's body. It does not include leg protection beyond simple greaves that are attached with leather straps."
			]
		},
		{
			"name": "Hand Crossbow",
			"source": "PHB",
			"page": 149,
			"srd": true,
			"basicRules": true,
			"type": "R",
			"rarity": "none",
			"weight": 3,
			"value": 7500,
			"weaponCategory": "martial",
			"property": [
				"A",
				"L",
				"LD"
			],
			"range": "30/120",
			"dmg1": "1d6",
			"dmgType": "P",
			"crossbow": true,
			"weapon": true,
			"ammoType": "crossbow bolt|phb"
		},
		{
			"name": "Handaxe",
			"source": "PHB",
			"page": 149,
			"srd": true,
			"basicRules": true,
			"type": "M",
			"rarity": "none",
			"weight": 2,
			"value": 500,
			"weaponCategory": "simple",
			"property": [
				"L",
				"T"
			],
			"range": "20/60",
			"dmg1": "1d6",
			"dmgType": "S",
			"axe": true,
			"weapon": true
		},
		{
			"name": "Heavy Crossbow",
			"source": "PHB",
			"page": 149,
			"srd": true,
			"basicRules": true,
			"type": "R",
			"rarity": "none",
			"weight": 18,
			"value": 5000,